{
  "applications": [
    {
      "application_id": "response",
      "definition_ids": [
        "attention",
        "expression"
      ],
      "kind": "option",
      "subject_ids": [
        "subject"
      ],
      "text": "A pause may be chosen after attending to the recipient; no exact line or motive is prescribed."
    }
  ],
  "artifact_type": "scene-persona-material",
  "audience": "authoring",
  "conditions": [
    "Only the stated activity and currently supplied recipient information are in scope."
  ],
  "constraints": [
    "Do not infer a human voice or body from this functional model."
  ],
  "content_sha256": "9c6139b83f34c4ef8a673ec2cb2d936e51a19fceeb7946ceef651a690a20a224",
  "definitions": [
    {
      "anchor": "Controlling definition",
      "covers": [
        "Controlling definition"
      ],
      "depends_on": [],
      "excerpt_id": "attention",
      "reason": "The controlling definition governs expression.",
      "source_id": "model",
      "source_sha256": "568809ee54283dc92dd3b742b08dc761d4eca923681a6b0b330484148975cf23",
      "subject_ids": [
        "subject"
      ],
      "text": "# Controlling definition\nAttend to the recipient before choosing a response.",
      "text_sha256": "3e0daf8ce6c543bdd322aeb38b44884e0c731b421c7e058c0cc868622b519179"
    },
    {
      "anchor": "Expression",
      "covers": [
        "Expression"
      ],
      "depends_on": [
        "attention"
      ],
      "excerpt_id": "expression",
      "reason": "Do not replace a contextual response with a stock emotion.",
      "source_id": "model",
      "source_sha256": "568809ee54283dc92dd3b742b08dc761d4eca923681a6b0b330484148975cf23",
      "subject_ids": [
        "subject"
      ],
      "text": "# Expression\nA pause is an available response, not automatically distress.",
      "text_sha256": "03cac6ab015afb20387d79c0b5c64d1a3be0013fd05ed6835503e5c4dfc1d28d"
    }
  ],
  "interactions": [],
  "material_id": "prepared-activity",
  "purpose": "Demonstrate persistent definitions and scoped applications without a mandatory story pattern.",
  "reopen_when": [
    "The recipient, information, purpose or original model changes."
  ],
  "review": {
    "basis": "Software/data-flow demonstration only.",
    "by": "constructed-example-author",
    "decision": "ready",
    "limitations": [
      "This is not evidence of artistic suitability; read real full Personas when preparing actual work."
    ],
    "revisions": []
  },
  "scene_id": "activity",
  "scene_source_id": "scene",
  "source_set_sha256": "39eff5dfe5590d88d67297a024f6707a1bc141f92ecd44514fe6c16e0954e140",
  "sources": [
    {
      "bytes": 253,
      "path": "originals/subject.md",
      "reading_basis": "Constructed example: the complete short source is shown; not evidence of real-agent reading.",
      "role": "functional",
      "sha256": "568809ee54283dc92dd3b742b08dc761d4eca923681a6b0b330484148975cf23",
      "source_id": "model",
      "subject_ids": [
        "subject"
      ],
      "units": [
        {
          "anchor": "Controlling definition",
          "blank": false,
          "sha256": "3e0daf8ce6c543bdd322aeb38b44884e0c731b421c7e058c0cc868622b519179"
        },
        {
          "anchor": "Expression",
          "blank": false,
          "sha256": "03cac6ab015afb20387d79c0b5c64d1a3be0013fd05ed6835503e5c4dfc1d28d"
        },
        {
          "anchor": "Contextual condition",
          "blank": false,
          "sha256": "382dacc171a44caddf311294138cbc87b1e73256642c7f2d457c7365932f1ebe"
        }
      ]
    },
    {
      "bytes": 159,
      "path": "originals/scene.md",
      "reading_basis": "Constructed example: the complete short source is shown; not evidence of real-agent reading.",
      "role": "scene",
      "sha256": "7a0158e5af8805bdbf93835eeb32d7f2647f2fd5ded6457087ae27e21cebb7c7",
      "source_id": "scene",
      "subject_ids": [],
      "units": [
        {
          "anchor": "preamble",
          "blank": false,
          "sha256": "8b4d09cee05ea01ad46d9d33e72d5e1e6863c2d090bf6b532f06465f0dde0a5b"
        }
      ]
    }
  ],
  "subjects": [
    {
      "model": "functional",
      "portrayal_basis": "Use this small declared response model; do not presume human psychology.",
      "source_ids": [
        "model"
      ],
      "subject_id": "subject"
    }
  ],
  "supersedes": null,
  "unknowns": [
    "The recipient and final response are intentionally unspecified."
  ]
}
